[{"id":"Q001","userPrompt":"Write a spec for Q001","difficulty":"basic","projectContext":{"description":"Test project","files":[]},"scoringCriteria":{"outcome":{"weight":0.3,"checks":[{"id":"o1","description":"Complete task","passCondition":"Output exists"}]},"process":{"weight":0.3,"checks":[{"id":"p1","description":"Follow process","passCondition":"Steps done"}]},"style":{"weight":0.2,"checks":[{"id":"s1","description":"Correct format","passCondition":"Valid format"}]},"efficiency":{"weight":0.2,"checks":[{"id":"e1","description":"Efficient","passCondition":"Quick"}]}}},{"id":"Q002","userPrompt":"Write a spec for Q002","difficulty":"advanced","projectContext":{"description":"Test project","files":[]},"scoringCriteria":{"outcome":{"weight":0.3,"checks":[{"id":"o1","description":"Complete task","passCondition":"Output exists"}]},"process":{"weight":0.3,"checks":[{"id":"p1","description":"Follow process","passCondition":"Steps done"}]},"style":{"weight":0.2,"checks":[{"id":"s1","description":"Correct format","passCondition":"Valid format"}]},"efficiency":{"weight":0.2,"checks":[{"id":"e1","description":"Efficient","passCondition":"Quick"}]}}},{"id":"Q003","userPrompt":"Write a spec for Q003","difficulty":"edge","projectContext":{"description":"Test project","files":[]},"scoringCriteria":{"outcome":{"weight":0.3,"checks":[{"id":"o1","description":"Complete task","passCondition":"Output exists"}]},"process":{"weight":0.3,"checks":[{"id":"p1","description":"Follow process","passCondition":"Steps done"}]},"style":{"weight":0.2,"checks":[{"id":"s1","description":"Correct format","passCondition":"Valid format"}]},"efficiency":{"weight":0.2,"checks":[{"id":"e1","description":"Efficient","passCondition":"Quick"}]}}}]